{
  "$schema": "../../schemas/song.schema.json",
  "bassTrack": "Ben Shepard | Fender Jazz | Bass",
  "media": {
    "youtube": {
      "videoId": null,
      "sync": [
        {
          "bar": 1,
          "ms": 0
        }
      ]
    },
    "spotify": {
      "trackUri": null,
      "sync": []
    }
  },
  "chunks": null,
  "fingeringOverrides": [],
  "lyrics": null
}
